Sheet: Sheet1
A1: Регрессионный анализ
C2: 1 | D2: 2 | E2: 3 | F2: 4 | G2: 5 | H2: 6 | I2: 7 | J2: 8 | K2: 9 | L2: 10 | M2: 11 | N2: 12 | O2: 13 | P2: 14 | Q2: 15
B3: X | C3: -1 | D3: -0.8 | E3: -0.6 | F3: -0.4 | G3: -0.2 | H3: 0 | I3: 0.2 | J3: 0.4 | K3: 0.6 | L3: 0.8 | M3: 1 | N3: 1.2 | O3: 1.4 | P3: 1.6 | Q3: 1.8
B4: Y | C4: -2.1 | D4: -2.9 | E4: -3.5 | F4: -4.0999999999999996 | G4: -4.2 | H4: -3.9 | I4: -3.7 | J4: -3.2 | K4: -1.3 | L4: 0.2 | M4: 1.5 | N4: 3.4 | O4: 5.3 | P4: 5.7 | Q4: 7.5
B6: При изучении зависимости между величиной X и величиной Y были получены следующие значения (см. таблицу соответствующего варианта). Требуется: • построить график Y=f(X); • рассчитать параметры уравнения линейной регрессии методом наименьших квадратов; • оценить качество полученного уравнения регрессии с помощью средней ошибки аппроксимации; • найти коэффициент корреляции; • оценить значимость коэффициента корреляции и коэффициента регрессии по критерию Стьюдента (t- критерий) при уровне значимости ; • сделать выводы.
B19: X^2 | C19: =R[-16]C*R[-16]C -> 1 | D19: =R[-16]C*R[-16]C -> 0.64000000000000012 | E19: =R[-16]C*R[-16]C -> 0.36 | F19: =R[-16]C*R[-16]C -> 0.16000000000000003 | G19: =R[-16]C*R[-16]C -> 4.0000000000000008E-2 | H19: =R[-16]C*R[-16]C -> 0 | I19: =R[-16]C*R[-16]C -> 4.0000000000000008E-2 | J19: =R[-16]C*R[-16]C -> 0.16000000000000003 | K19: =R[-16]C*R[-16]C -> 0.36 | L19: =R[-16]C*R[-16]C -> 0.64000000000000012 | M19: =R[-16]C*R[-16]C -> 1 | N19: =R[-16]C*R[-16]C -> 1.44 | O19: =R[-16]C*R[-16]C -> 1.9599999999999997 | P19: =R[-16]C*R[-16]C -> 2.5600000000000005 | Q19: =R[-16]C*R[-16]C -> 3.24
B20: Y^2 | C20: =R[-16]C*R[-16]C -> 4.41 | D20: =R[-16]C*R[-16]C -> 8.41 | E20: =R[-16]C*R[-16]C -> 12.25 | F20: =R[-16]C*R[-16]C -> 16.809999999999999 | G20: =R[-16]C*R[-16]C -> 17.64 | H20: =R[-16]C*R[-16]C -> 15.209999999999999 | I20: =R[-16]C*R[-16]C -> 13.690000000000001 | J20: =R[-16]C*R[-16]C -> 10.240000000000002 | K20: =R[-16]C*R[-16]C -> 1.6900000000000002 | L20: =R[-16]C*R[-16]C -> 4.0000000000000008E-2 | M20: =R[-16]C*R[-16]C -> 2.25 | N20: =R[-16]C*R[-16]C -> 11.559999999999999 | O20: =R[-16]C*R[-16]C -> 28.09 | P20: =R[-16]C*R[-16]C -> 32.49 | Q20: =R[-16]C*R[-16]C -> 56.25
B21: X*Y | C21: =R[-18]C*R[-17]C -> 2.1 | D21: =R[-18]C*R[-17]C -> 2.3199999999999998 | E21: =R[-18]C*R[-17]C -> 2.1 | F21: =R[-18]C*R[-17]C -> 1.64 | G21: =R[-18]C*R[-17]C -> 0.84000000000000008 | H21: =R[-18]C*R[-17]C -> 0 | I21: =R[-18]C*R[-17]C -> -0.7400000000000001 | J21: =R[-18]C*R[-17]C -> -1.2800000000000002 | K21: =R[-18]C*R[-17]C -> -0.78 | L21: =R[-18]C*R[-17]C -> 0.16000000000000003 | M21: =R[-18]C*R[-17]C -> 1.5 | N21: =R[-18]C*R[-17]C -> 4.08 | O21: =R[-18]C*R[-17]C -> 7.419999999999999 | P21: =R[-18]C*R[-17]C -> 9.120000000000001 | Q21: =R[-18]C*R[-17]C -> 13.5
B23: Xsum = | C23: =SUM(R[-20]C:R[-20]C[14]) -> 6
B24: Ysum = | C24: =SUM(R[-20]C:R[-20]C[14]) -> -5.3000000000000007 | E24: -0,35333 = a + b * 0,4
B25: X^2sum = | C25: =SUM(R[-6]C:R[-6]C[14]) -> 13.6 | E25: 41.98 = a * 6 + b * 13,6
B26: Xsum/n = | C26: =SUM(R[-23]C:R[-23]C[14])/R[-24]C[14] -> 0.4
B27: Ysum/n= | C27: =SUM(R[-23]C:R[-23]C[14])/R[-25]C[14] -> -0.35333333333333339 | F27: -2,11998 = 6a + 2.4b
B28: XYSum= | C28: =SUM(R[-7]C:R[-7]C[14]) -> 41.980000000000004 | F28: 41.98 = 6a + 13.6b
B29: Xavg = | C29: =AVERAGE(R[-26]C:R[-26]C[14]) -> 0.4
F30: 44,09998 = 11.2b
F31: b = 3.9375
F32: a = 1.9283
B33: y` = 3.9375 * x + 1.9283
B35: Y` | C35: =R[-32]C*3.9375 + 1.9283 -> -2.0091999999999999 | D35: =R[-32]C*3.9375 + 1.9283 -> -1.2217000000000005 | E35: =R[-32]C*3.9375 + 1.9283 -> -0.43419999999999992 | F35: =R[-32]C*3.9375 + 1.9283 -> 0.35329999999999973 | G35: =R[-32]C*3.9375 + 1.9283 -> 1.1407999999999998 | H35: =R[-32]C*3.9375 + 1.9283 -> 1.9282999999999999 | I35: =R[-32]C*3.9375 + 1.9283 -> 2.7157999999999998 | J35: =R[-32]C*3.9375 + 1.9283 -> 3.5033000000000003 | K35: =R[-32]C*3.9375 + 1.9283 -> 4.2907999999999999 | L35: =R[-32]C*3.9375 + 1.9283 -> 5.0783000000000005 | M35: =R[-32]C*3.9375 + 1.9283 -> 5.8658000000000001 | N35: =R[-32]C*3.9375 + 1.9283 -> 6.6532999999999998 | O35: =R[-32]C*3.9375 + 1.9283 -> 7.4407999999999994 | P35: =R[-32]C*3.9375 + 1.9283 -> 8.2283000000000008 | Q35: =R[-32]C*3.9375 + 1.9283 -> 9.0158000000000005
C37: =ABS(R[-33]C-R[-2]C/R[-2]C) -> 3.1 | D37: =ABS(R[-33]C-R[-2]C/R[-2]C) -> 3.9 | E37: =ABS(R[-33]C-R[-2]C/R[-2]C) -> 4.5 | F37: =ABS(R[-33]C-R[-2]C/R[-2]C) -> 5.0999999999999996 | G37: =ABS(R[-33]C-R[-2]C/R[-2]C) -> 5.2 | H37: =ABS(R[-33]C-R[-2]C/R[-2]C) -> 4.9000000000000004 | I37: =ABS(R[-33]C-R[-2]C/R[-2]C) -> 4.7 | J37: =ABS(R[-33]C-R[-2]C/R[-2]C) -> 4.2 | K37: =ABS(R[-33]C-R[-2]C/R[-2]C) -> 2.2999999999999998 | L37: =ABS(R[-33]C-R[-2]C/R[-2]C) -> 0.8 | M37: =ABS(R[-33]C-R[-2]C/R[-2]C) -> 0.5 | N37: =ABS(R[-33]C-R[-2]C/R[-2]C) -> 2.4 | O37: =ABS(R[-33]C-R[-2]C/R[-2]C) -> 4.3 | P37: =ABS(R[-33]C-R[-2]C/R[-2]C) -> 4.7 | Q37: =ABS(R[-33]C-R[-2]C/R[-2]C) -> 6.5
B38: Z1 | C38: =SUM(R[-1]C:R[-1]C[14])/15 -> 3.8066666666666662
C39: =POWER(R[-35]C-R[-4]C,2) -> 8.2446400000000392E-3 | D39: =POWER(R[-35]C-R[-4]C,2) -> 2.8166908899999981 | E39: =POWER(R[-35]C-R[-4]C,2) -> 9.3991296400000017 | F39: =POWER(R[-35]C-R[-4]C,2) -> 19.831880889999997 | G39: =POWER(R[-35]C-R[-4]C,2) -> 28.524144639999996 | H39: =POWER(R[-35]C-R[-4]C,2) -> 33.969080889999994 | I39: =POWER(R[-35]C-R[-4]C,2) -> 41.162489639999997 | J39: =POWER(R[-35]C-R[-4]C,2) -> 44.934230890000009 | K39: =POWER(R[-35]C-R[-4]C,2) -> 31.257044639999997 | L39: =POWER(R[-35]C-R[-4]C,2) -> 23.797810890000004 | M39: =POWER(R[-35]C-R[-4]C,2) -> 19.06020964 | N39: =POWER(R[-35]C-R[-4]C,2) -> 10.583960889999998 | O39: =POWER(R[-35]C-R[-4]C,2) -> 4.5830246399999979 | P39: =POWER(R[-35]C-R[-4]C,2) -> 6.3923008900000031 | Q39: =POWER(R[-35]C-R[-4]C,2) -> 2.2976496400000013
B40: Z2 | C40: =SQRT(SUM(R[-1]C:R[-1]C[14]))/15 -> 1.112790073743571
B42: R = | C42: =(15 * R[-14]C - R[-18]C*R[-19]C) / SQRT( ( (15*R[-17]C - R[-19]C*R[-19]C)*(15 * SUM(R[-22]C:R[-22]C[14]) - POWER(SUM(R[-38]C:R[-38]C[14]),2) ) )) -> 0.8704878189096672
B44: t = | C44: =R[-2]C*(15-2)/SQRT(1-R[-2]C*R[-2]C) -> 22.991817298272714
A45: Табличное значение распределения Стьюдента с вероятностью 0,95, как видно значение нашего параметра t больше табличного, следовательно, оценка коэффициента корреляции является значимой.
B47: t = | C47: =3.9375/SQRT(1/(15-2) * (1)) -> 14.196858147139457